{
  "schema_version": 1,
  "fixture_kind": "contract-golden",
  "platform_id": "linux_aarch64_musl",
  "command": ["ipfs-kit-iroh-sidecar", "--version"],
  "exit_code": 0,
  "stdout": "ipfs-kit-iroh-sidecar 0.1.0 (protocol 1; iroh 1.0.2; iroh-blobs 0.103.0; iroh-docs 0.101.0; iroh-gossip 0.101.0)\n",
  "stderr": ""
}
